{
  "appId": "PUBID.bcility1636664056498|AID.bcility-pdf-password-protection|PAPPID.3165780a-70e7-4f6a-8cd4-0b77aeee7dcc",
  "guid": "3165780a-70e7-4f6a-8cd4-0b77aeee7dcc",
  "publisherId": "bcility1636664056498",
  "offerId": "bcility-pdf-password-protection",
  "source": {
    "name": "PDF Password Protection",
    "publisher": "BCILITY",
    "productType": "DynamicsBC",
    "url": "https://appsource.microsoft.com/en-us/product/dynamics-365-business-central/PUBID.bcility1636664056498%7CAID.bcility-pdf-password-protection%7CPAPPID.3165780a-70e7-4f6a-8cd4-0b77aeee7dcc",
    "lastModified": "2025-12-14T23:33:09.726151+00:00",
    "appVersion": "26.0.3.10",
    "pricingTypes": [],
    "freeTrial": null,
    "helpLink": "https://bcility.com/about-us/",
    "sourceHash": "sha256:01181182b4fd31240c682b1f042dea4c50c9b778e4732a5605d5c17076187ae9",
    "mentionsBC": true,
    "allCountries": true
  },
  "mapping": {
    "sourceHash": "sha256:01181182b4fd31240c682b1f042dea4c50c9b778e4732a5605d5c17076187ae9",
    "mappedOn": null,
    "summary": "Password-protects PDFs exported from Business Central",
    "shape": "usability",
    "primary": [
      {
        "need": "ng-admin-it-compliance",
        "confidence": "medium"
      }
    ],
    "secondary": [
      "ng-ux-document-layouts"
    ],
    "claims": [
      "Applies password protection to all PDF exports automatically",
      "Read-only password and optional admin password",
      "Different passwords per business area",
      "Optional dialog to enter password before export",
      "Automatically assigns reports to protection areas"
    ],
    "countries": [],
    "languages": [
      "en"
    ],
    "industries": [],
    "connectsTo": [
      "Azure"
    ],
    "requires": [],
    "deployment": "not_stated",
    "pricing": "contact",
    "hide": false,
    "hideReason": "",
    "noFit": ""
  },
  "curated": {
    "overrides": {},
    "locked": false,
    "note": ""
  }
}
