{
  "appId": "PUBID.nav2day1602851102644|AID.n2d_p2s|PAPPID.2aad7aa5-1404-4a74-a45e-cc6e7bf4c1ee",
  "guid": "2aad7aa5-1404-4a74-a45e-cc6e7bf4c1ee",
  "publisherId": "nav2day1602851102644",
  "offerId": "n2d_p2s",
  "source": {
    "name": "Purchase to Sales",
    "publisher": "nav2day",
    "productType": "DynamicsBC",
    "url": "https://appsource.microsoft.com/en-us/product/dynamics-365-business-central/PUBID.nav2day1602851102644%7CAID.n2d_p2s%7CPAPPID.2aad7aa5-1404-4a74-a45e-cc6e7bf4c1ee",
    "lastModified": "2026-05-25T10:31:14.5599414+00:00",
    "appVersion": "28.1.0.1",
    "pricingTypes": [
      "FreeTrial",
      "Payg"
    ],
    "freeTrial": "1 Month",
    "helpLink": "https://nav2day.com/docs/nav2day-purchase-to-sales/",
    "sourceHash": "sha256:d12a0d40a0418d35397a48eeb29825e002f43270b8a04f6d48c09382632460b0",
    "mentionsBC": false,
    "allCountries": false
  },
  "mapping": {
    "sourceHash": "sha256:d12a0d40a0418d35397a48eeb29825e002f43270b8a04f6d48c09382632460b0",
    "mappedOn": null,
    "summary": "Converts purchase documents to sales documents for re-billing",
    "shape": "process",
    "primary": [
      {
        "need": "ng-sales-invoicing",
        "confidence": "medium"
      }
    ],
    "secondary": [],
    "claims": [
      "Converts purchase documents into sales documents for re-billing",
      "Puts billing fields on every purchase document page",
      "Each purchase line can be billed to a different customer"
    ],
    "countries": [],
    "languages": [],
    "industries": [],
    "connectsTo": [],
    "requires": [],
    "deployment": "not_stated",
    "pricing": "subscription",
    "hide": false,
    "hideReason": "",
    "noFit": ""
  },
  "curated": {
    "overrides": {},
    "locked": false,
    "note": ""
  }
}
