{
  "appId": "PUBID.bittaapps1643615841013|AID.universal-search|PAPPID.96ffd29b-3dbc-4f02-a1cc-10b18d38a94a",
  "guid": "96ffd29b-3dbc-4f02-a1cc-10b18d38a94a",
  "publisherId": "bittaapps1643615841013",
  "offerId": "universal-search",
  "source": {
    "name": "Universal Search",
    "publisher": "Bitta Apps, LLC",
    "productType": "DynamicsBC",
    "url": "https://appsource.microsoft.com/en-us/product/dynamics-365-business-central/PUBID.bittaapps1643615841013%7CAID.universal-search%7CPAPPID.96ffd29b-3dbc-4f02-a1cc-10b18d38a94a",
    "lastModified": "2026-07-06T07:53:39.4564551+00:00",
    "appVersion": "1.0.0.0",
    "pricingTypes": [],
    "freeTrial": null,
    "helpLink": "https://www.bittaapps.com/solutions/universal-search",
    "sourceHash": "sha256:c0063d175db96c35b4dd99dfe36000f5f1d46d52fcd401ae50e43e232e16e9a9",
    "mentionsBC": true,
    "allCountries": true
  },
  "mapping": {
    "sourceHash": "sha256:c0063d175db96c35b4dd99dfe36000f5f1d46d52fcd401ae50e43e232e16e9a9",
    "mappedOn": null,
    "summary": "Fuzzy global search for any record",
    "shape": "usability",
    "primary": [
      {
        "need": "ng-ux-search-navigation",
        "confidence": "high"
      }
    ],
    "secondary": [
      "ng-ux-developer-tools"
    ],
    "claims": [
      "Single search box across customers, vendors, items, contacts and any indexed table",
      "Tolerates typos, word order, spacing, fragments and sound-alike spelling",
      "Filter chips with live match counts per table",
      "Relevance ranking with configurable per-field weights",
      "Respects user permissions",
      "Background index with configurable tables and fields",
      "Public API and ten integration events for developers"
    ],
    "countries": [],
    "languages": [
      "en"
    ],
    "industries": [],
    "connectsTo": [],
    "requires": [],
    "deployment": "not_stated",
    "pricing": "free",
    "hide": false,
    "hideReason": "",
    "noFit": ""
  },
  "curated": {
    "overrides": {},
    "locked": false,
    "note": ""
  }
}
