{
  "appId": "PUBID.fenwicksoftware|AID.gld-meo-connector-app|PAPPID.4bf50f1c-96d9-466b-8dd8-6c350f9e33f7",
  "guid": "4bf50f1c-96d9-466b-8dd8-6c350f9e33f7",
  "publisherId": "fenwicksoftware",
  "offerId": "gld-meo-connector-app",
  "source": {
    "name": "Good Looking Documents for MEO",
    "publisher": "Fenwick",
    "productType": "DynamicsBC",
    "url": "https://appsource.microsoft.com/en-us/product/dynamics-365-business-central/PUBID.fenwicksoftware%7CAID.gld-meo-connector-app%7CPAPPID.4bf50f1c-96d9-466b-8dd8-6c350f9e33f7",
    "lastModified": "2026-08-16T23:56:46.383768+00:00",
    "appVersion": "27.0.260728.5",
    "pricingTypes": [],
    "freeTrial": null,
    "helpLink": "https://www.fenwick.com.au/solutions/multiple-entity-operations/",
    "sourceHash": "sha256:f2cc1b49d11a136a9aacb7ba0ef6f64e527797be62c7736c30bb164e0719f5ed",
    "mentionsBC": true,
    "allCountries": true
  },
  "mapping": {
    "sourceHash": "sha256:f2cc1b49d11a136a9aacb7ba0ef6f64e527797be62c7736c30bb164e0719f5ed",
    "mappedOn": null,
    "summary": "Bridges Good Looking Documents with Multiple Entity Operations",
    "shape": "addon",
    "primary": [
      {
        "need": "ng-ux-document-layouts",
        "confidence": "low"
      }
    ],
    "secondary": [],
    "claims": [
      "Connects Good Looking Documents to Multiple Entity Operations"
    ],
    "countries": [],
    "languages": [
      "en"
    ],
    "industries": [],
    "connectsTo": [],
    "requires": [
      "Fenwick Good Looking Documents",
      "Fenwick Multiple Entity Operations"
    ],
    "deployment": "not_stated",
    "pricing": "not_stated",
    "hide": true,
    "hideReason": "Connector app between two Fenwick apps",
    "noFit": ""
  },
  "curated": {
    "overrides": {},
    "locked": false,
    "note": ""
  }
}
