{
  "appId": "TYPE.connect|PUBID.floqast1635450348233|AID.floqast_microsoft_business_central|PAPPID.2846c0ec-ed95-4b78-a829-3a9f2223f256",
  "guid": "2846c0ec-ed95-4b78-a829-3a9f2223f256",
  "publisherId": "floqast1635450348233",
  "offerId": "floqast_microsoft_business_central",
  "source": {
    "name": "FloQast Accounting Transformation Platform",
    "publisher": "FloQast",
    "productType": "DynamicsBC",
    "url": "https://appsource.microsoft.com/en-us/product/dynamics-365-business-central/TYPE.connect%7CPUBID.floqast1635450348233%7CAID.floqast_microsoft_business_central%7CPAPPID.2846c0ec-ed95-4b78-a829-3a9f2223f256",
    "lastModified": "2025-08-21T15:40:55.0152987+00:00",
    "appVersion": "2021.0.0.1",
    "pricingTypes": [],
    "freeTrial": null,
    "helpLink": "https://www.floqast.com/resources",
    "sourceHash": "sha256:7c0583d668c1370d33debaf3ee985811573fa6b1ee77874f8611f2a78c0e4ca3",
    "mentionsBC": true,
    "allCountries": true
  },
  "mapping": {
    "sourceHash": "sha256:7c0583d668c1370d33debaf3ee985811573fa6b1ee77874f8611f2a78c0e4ca3",
    "mappedOn": null,
    "summary": "Month-end close management via FloQast",
    "shape": "connector",
    "primary": [
      {
        "need": "ng-period-close",
        "confidence": "high"
      },
      {
        "need": "ng-gl-reconciliation",
        "confidence": "high"
      }
    ],
    "secondary": [
      "ng-audit-compliance",
      "ng-financial-statements",
      "ng-journals"
    ],
    "claims": [
      "Supports closing the books with tailored checklists, shared projects and dashboards that update live",
      "Automated account reconciliations",
      "AI-powered transaction matching and AI agents",
      "GRC integration for control monitoring, design, testing and remediation",
      "Consolidation, draft financial statements and automated variance analysis",
      "Integrates with BC, Excel, OneDrive and Microsoft Teams",
      "Supports BC Essentials and Premium",
      "Supports all countries and languages"
    ],
    "countries": [],
    "languages": [],
    "industries": [],
    "connectsTo": [
      "FloQast",
      "Excel",
      "OneDrive",
      "Microsoft Teams"
    ],
    "requires": [],
    "deployment": "not_stated",
    "pricing": "not_stated",
    "hide": false,
    "hideReason": "",
    "noFit": ""
  },
  "curated": {
    "overrides": {},
    "locked": false,
    "note": ""
  }
}
