{
  "appId": "PUBID.brightcom_3111464|AID.brc_retail_extension|PAPPID.1615a8c9-24c3-434e-8482-f278027dcd1d",
  "guid": "1615a8c9-24c3-434e-8482-f278027dcd1d",
  "publisherId": "brightcom_3111464",
  "offerId": "brc_retail_extension",
  "source": {
    "name": "BRC Retail Extension",
    "publisher": "BrightCom Solutions AB",
    "productType": "DynamicsBC",
    "url": "https://appsource.microsoft.com/en-us/product/dynamics-365-business-central/PUBID.brightcom_3111464%7CAID.brc_retail_extension%7CPAPPID.1615a8c9-24c3-434e-8482-f278027dcd1d",
    "lastModified": "2026-10-30T06:00:57.2596569+00:00",
    "appVersion": "28.0.37643.0",
    "pricingTypes": [
      "ContactPublisher"
    ],
    "freeTrial": null,
    "helpLink": "https://docs.brightcom.se/sv/Products/BRCRetail",
    "sourceHash": "sha256:6711cde47ca43ccad6687729a020a88a41a1c898667ee0ba1dd0dcc59aa8af16",
    "mentionsBC": true
  },
  "mapping": {
    "sourceHash": "sha256:6711cde47ca43ccad6687729a020a88a41a1c898667ee0ba1dd0dcc59aa8af16",
    "mappedOn": "2026-10-30",
    "summary": "Item variant management for retail and fashion: size/colour matrices, EANs, variant prices and stock.",
    "shape": "process",
    "primary": [
      {
        "need": "ng-item-master-data",
        "confidence": "high"
      },
      {
        "need": "ng-vert-fashion",
        "confidence": "medium"
      }
    ],
    "secondary": [
      "ng-sales-order-entry",
      "ng-sales-pricing",
      "ng-inventory-analysis",
      "ng-purchase-orders"
    ],
    "claims": [
      "Matrix-based variant creation from configurable templates",
      "Matrix entry of quantities per variant on sales and purchase orders",
      "Links vendor item numbers, barcodes and brands per variant",
      "Variant-level sales and purchase prices",
      "Stock per variant and location with EAN shown",
      "Inventory valuation by size, colour or other variant dimension",
      "Translated variant values and configurable sort order",
      "Label printing with EAN and price is planned",
      "Works on Essentials and Premium"
    ],
    "countries": [
      "DK",
      "NO",
      "SE"
    ],
    "languages": [
      "en"
    ],
    "industries": [
      "Fashion",
      "Retail"
    ],
    "connectsTo": [],
    "requires": [],
    "deployment": "not_stated",
    "pricing": "contact",
    "hide": false,
    "hideReason": "",
    "noFit": ""
  },
  "curated": {
    "overrides": {},
    "locked": false,
    "note": ""
  }
}
