{
  "appId": "TYPE.connect|PUBID.plussoftwaresolutionsptyltd1616978005823|AID.forecastlive|PAPPID.81064bee-07d1-4f35-964b-ab726e3bebff",
  "guid": "81064bee-07d1-4f35-964b-ab726e3bebff",
  "publisherId": "plussoftwaresolutionsptyltd1616978005823",
  "offerId": "forecastlive",
  "source": {
    "name": "Forecast Live",
    "publisher": "PLUS SOFTWARE SOLUTIONS PTY LTD",
    "productType": "DynamicsBC",
    "url": "https://appsource.microsoft.com/en-us/product/dynamics-365-business-central/TYPE.connect%7CPUBID.plussoftwaresolutionsptyltd1616978005823%7CAID.forecastlive%7CPAPPID.81064bee-07d1-4f35-964b-ab726e3bebff",
    "lastModified": "2025-08-26T19:39:58.5926167+00:00",
    "appVersion": "22.3.6388.19",
    "pricingTypes": [],
    "freeTrial": null,
    "helpLink": "https://plus.live/support/",
    "sourceHash": "sha256:8dac2d00eab5dabbf129f70a9ce599446be5861833cb21c762e5599b0366ab2c",
    "mentionsBC": true,
    "allCountries": false
  },
  "mapping": {
    "sourceHash": "sha256:8dac2d00eab5dabbf129f70a9ce599446be5861833cb21c762e5599b0366ab2c",
    "mappedOn": null,
    "summary": "Cash flow forecasting and overdue invoice collection with AI",
    "shape": "process",
    "primary": [
      {
        "need": "ng-cash-forecast",
        "confidence": "high"
      },
      {
        "need": "ng-collections",
        "confidence": "high"
      }
    ],
    "secondary": [
      "ng-budget-vs-actual"
    ],
    "claims": [
      "Daily, weekly and monthly cashflow scheduling",
      "Automatically sends overdue reminders with invoices attached",
      "Machine learning on financial history for debtor and cashflow guidance",
      "Automatic integration to BC",
      "Available in English (UK, US, AU)"
    ],
    "countries": [
      "AE",
      "AU",
      "CA",
      "DK",
      "FI",
      "GB",
      "HK",
      "ID",
      "IE",
      "IN",
      "IS",
      "KE",
      "LK",
      "MT",
      "MY",
      "NG",
      "NL",
      "NO",
      "NZ",
      "PH",
      "QA",
      "SA",
      "SE",
      "SG",
      "US",
      "ZA"
    ],
    "languages": [
      "en"
    ],
    "industries": [],
    "connectsTo": [],
    "requires": [],
    "deployment": "not_stated",
    "pricing": "not_stated",
    "hide": false,
    "hideReason": "",
    "noFit": ""
  },
  "curated": {
    "overrides": {},
    "locked": false,
    "note": ""
  }
}
