{
  "appId": "PUBID.wsb_solutions|AID.custom_tiles|PAPPID.c069e70a-6e6c-4ee6-afb7-fac363c97efc",
  "guid": "c069e70a-6e6c-4ee6-afb7-fac363c97efc",
  "publisherId": "wsb_solutions",
  "offerId": "custom_tiles",
  "source": {
    "name": "Custom Tiles",
    "publisher": "Apportunix",
    "productType": "DynamicsBC",
    "url": "https://appsource.microsoft.com/en-us/product/dynamics-365-business-central/PUBID.wsb_solutions%7CAID.custom_tiles%7CPAPPID.c069e70a-6e6c-4ee6-afb7-fac363c97efc",
    "lastModified": "2026-10-26T07:03:23.3788582+00:00",
    "appVersion": "1.0.0.0",
    "pricingTypes": [
      "ExternalFreeTrial"
    ],
    "freeTrial": null,
    "helpLink": "https://docs.customfields.apportunix.com/",
    "sourceHash": "sha256:6f90ad73813544227752e47bb7d8a0c2f2337eb6fe5ab66fdaf39622f1223de0",
    "mentionsBC": true
  },
  "mapping": {
    "sourceHash": "sha256:6f90ad73813544227752e47bb7d8a0c2f2337eb6fe5ab66fdaf39622f1223de0",
    "mappedOn": "2026-10-30",
    "summary": "Adds user-defined calculated tiles to role centers and factboxes without coding.",
    "shape": "usability",
    "primary": [
      {
        "need": "ng-ux-rolecenters",
        "confidence": "high"
      }
    ],
    "secondary": [
      "ng-ux-search-navigation",
      "ng-ux-custom-fields"
    ],
    "claims": [
      "Tiles calculate sums, averages and counts across related tables",
      "Tiles can sit in factboxes on customers, vendors, items, projects and sales, purchase and service documents",
      "A simulation action checks calculation performance before use",
      "Setup can be tried in an online sandbox first",
      "Includes the features of the publisher's Custom Fields app",
      "No development needed to configure tiles"
    ],
    "countries": [],
    "languages": [
      "de",
      "en",
      "nl"
    ],
    "industries": [],
    "connectsTo": [],
    "requires": [],
    "deployment": "not_stated",
    "pricing": "free_trial",
    "hide": false,
    "hideReason": "",
    "noFit": ""
  },
  "curated": {
    "overrides": {},
    "locked": false,
    "note": ""
  }
}
