{
  "appId": "TYPE.connect|PUBID.ensiorbv1583483100920|AID.edc_bc|PAPPID.cfad66ad-21b4-4192-b88a-e271c4c232de",
  "guid": "cfad66ad-21b4-4192-b88a-e271c4c232de",
  "publisherId": "ensiorbv1583483100920",
  "offerId": "edc_bc",
  "source": {
    "name": "EDC for Business Central",
    "publisher": "Ensior B.V.",
    "productType": "DynamicsBC",
    "url": "https://appsource.microsoft.com/en-us/product/dynamics-365-business-central/TYPE.connect%7CPUBID.ensiorbv1583483100920%7CAID.edc_bc%7CPAPPID.cfad66ad-21b4-4192-b88a-e271c4c232de",
    "lastModified": "2025-03-11T11:05:35.5714436+00:00",
    "appVersion": "23.5.0.0",
    "pricingTypes": [],
    "freeTrial": null,
    "helpLink": "https://www.ensior.com/en/solutions/technology/ensior-data-connectors",
    "sourceHash": "sha256:53b345a162a3d46fd69d938d48de5917bee9e9048f355c2d60b13a00bf5f3b9d",
    "mentionsBC": true,
    "allCountries": false
  },
  "mapping": {
    "sourceHash": "sha256:53b345a162a3d46fd69d938d48de5917bee9e9048f355c2d60b13a00bf5f3b9d",
    "mappedOn": null,
    "summary": "Extracts all Business Central data for analytics",
    "shape": "usability",
    "primary": [
      {
        "need": "ng-bi-dashboards",
        "confidence": "medium"
      }
    ],
    "secondary": [],
    "claims": [
      "Extracts all data from cloud BC for analytics",
      "Includes data from installed extensions",
      "Takes the BC version (flight) into account"
    ],
    "countries": [],
    "languages": [],
    "industries": [],
    "connectsTo": [],
    "requires": [],
    "deployment": "online",
    "pricing": "not_stated",
    "hide": false,
    "hideReason": "",
    "noFit": ""
  },
  "curated": {
    "overrides": {},
    "locked": false,
    "note": ""
  }
}
