{
  "appId": "PUBID.armadadynamicsas1615984193301|AID.eqm365rental_jobs|PAPPID.cb5a2085-e170-43f6-b8bd-aae5c135a2b0",
  "guid": "cb5a2085-e170-43f6-b8bd-aae5c135a2b0",
  "publisherId": "armadadynamicsas1615984193301",
  "offerId": "eqm365rental_jobs",
  "source": {
    "name": "EQM 365 Rental - Projects",
    "publisher": "Armada Dynamics AS",
    "productType": "DynamicsBC",
    "url": "https://appsource.microsoft.com/en-us/product/dynamics-365-business-central/PUBID.armadadynamicsas1615984193301%7CAID.eqm365rental_jobs%7CPAPPID.cb5a2085-e170-43f6-b8bd-aae5c135a2b0",
    "lastModified": "2026-10-12T17:52:45.7166+00:00",
    "appVersion": "28.5.202641.83263",
    "pricingTypes": [
      "ContactPublisher"
    ],
    "freeTrial": null,
    "helpLink": "https://www.armadadynamics.no/en/support/knowledge-database",
    "sourceHash": "sha256:d45015cd9dc9260b063d367ff5ef7df71a2ff395c204d4fc7fb8e5967414cdff",
    "mentionsBC": true
  },
  "mapping": {
    "sourceHash": "sha256:d45015cd9dc9260b063d367ff5ef7df71a2ff395c204d4fc7fb8e5967414cdff",
    "mappedOn": null,
    "summary": "Connects EQM rental with BC projects",
    "shape": "addon",
    "primary": [
      {
        "need": "ng-vert-equipment-rental",
        "confidence": "high"
      },
      {
        "need": "ng-proj-billing",
        "confidence": "medium"
      }
    ],
    "secondary": [
      "ng-proj-costs"
    ],
    "claims": [
      "Tracks rental revenues and costs in BC Projects",
      "Job-specific prices for resources, items and G/L accounts in the rental quote",
      "Automatically creates a job when a rental quote is won",
      "Job tasks reserved for services, consumables and rental equipment",
      "Internal daily cost on rental equipment applied to jobs",
      "Internal job invoicing sends periodic rental usage to the job",
      "Rental usage invoiced from the job with other usage"
    ],
    "countries": [
      "AE",
      "BE",
      "CA",
      "CH",
      "DE",
      "DK",
      "EE",
      "FI",
      "GB",
      "IS",
      "LT",
      "LV",
      "MX",
      "NL",
      "NO",
      "PL",
      "QA",
      "SE",
      "SI",
      "US",
      "ZA"
    ],
    "languages": [
      "de",
      "en",
      "fi",
      "fr",
      "nb",
      "nl"
    ],
    "industries": [
      "Equipment rental"
    ],
    "connectsTo": [],
    "requires": [
      "EQM 365 Rental"
    ],
    "deployment": "both",
    "pricing": "contact",
    "hide": false,
    "hideReason": "",
    "noFit": ""
  },
  "curated": {
    "overrides": {},
    "locked": false,
    "note": ""
  }
}
