{
  "appId": "hydrait.sol-23214-rci",
  "guid": null,
  "publisherId": "hydrait",
  "offerId": "sol-23214-rci",
  "source": {
    "name": "eColaborador Portal",
    "publisher": "Hydra IT",
    "productType": "SaaS",
    "url": "https://appsource.microsoft.com/en-us/product/web-apps/hydrait.sol-23214-rci",
    "lastModified": "2025-12-22T23:01:55.9088228+00:00",
    "appVersion": "v1.00",
    "pricingTypes": [],
    "freeTrial": null,
    "helpLink": null,
    "sourceHash": "sha256:d7c8ac4909468739401698ddce207ea76544b1abaf3cd6e3c82ec6d3d2f2ff10",
    "mentionsBC": true,
    "allCountries": false
  },
  "mapping": {
    "sourceHash": "sha256:d7c8ac4909468739401698ddce207ea76544b1abaf3cd6e3c82ec6d3d2f2ff10",
    "mappedOn": "2026-10-07",
    "summary": "Employee self-service portal for payslips, absences and holidays using Business Central HR data",
    "shape": "platform",
    "primary": [
      {
        "need": "ng-hr-absence-leave",
        "confidence": "high"
      },
      {
        "need": "ng-admin-portals",
        "confidence": "medium"
      }
    ],
    "secondary": [
      "ng-hr-employee-records"
    ],
    "claims": [
      "Employees view salary receipts",
      "Absence justification and holiday scheduling",
      "Employee data integrated with Business Central",
      "Configurable HR workflows across users"
    ],
    "countries": [],
    "languages": [],
    "industries": [],
    "connectsTo": [],
    "requires": [],
    "deployment": "online",
    "pricing": "not_stated",
    "hide": false,
    "hideReason": "",
    "noFit": ""
  },
  "curated": {
    "overrides": {},
    "locked": false,
    "note": ""
  }
}
