{
  "appId": "PUBID.bmsgmbh1605958738066|AID.bprint|PAPPID.7e972f9b-393e-48ef-b597-d6e1d25753ca",
  "guid": "7e972f9b-393e-48ef-b597-d6e1d25753ca",
  "publisherId": "bmsgmbh1605958738066",
  "offerId": "bprint",
  "source": {
    "name": "b-print",
    "publisher": "bms GmbH",
    "productType": "DynamicsBC",
    "url": "https://appsource.microsoft.com/en-us/product/dynamics-365-business-central/PUBID.bmsgmbh1605958738066%7CAID.bprint%7CPAPPID.7e972f9b-393e-48ef-b597-d6e1d25753ca",
    "lastModified": "2026-04-08T12:36:06.3380604+00:00",
    "appVersion": "3.1.42.1",
    "pricingTypes": [],
    "freeTrial": null,
    "helpLink": "https://bms-gmbh.com/kontakt/",
    "sourceHash": "sha256:d74e4054cf19de6e4d5c84dec8e20c1a2335f359e43ff2130160a5abba158fcc",
    "mentionsBC": true,
    "allCountries": false
  },
  "mapping": {
    "sourceHash": "sha256:d74e4054cf19de6e4d5c84dec8e20c1a2335f359e43ff2130160a5abba158fcc",
    "mappedOn": null,
    "summary": "Print management and print workflow configuration",
    "shape": "usability",
    "primary": [
      {
        "need": "ng-ux-printing",
        "confidence": "high"
      }
    ],
    "secondary": [
      "ng-ux-email-sending",
      "ng-ux-attachments"
    ],
    "claims": [
      "Set printers for each document type, department or user",
      "Supports network, cloud and local printers",
      "Print in PDF, Excel, Word and more",
      "Automated print jobs with rules and workflows",
      "Extended document sending profiles with email templates",
      "Link and store files on sales and purchase documents",
      "FileService framework for custom file operations e.g. EDI",
      "File browser for local file system"
    ],
    "countries": [],
    "languages": [
      "de",
      "en"
    ],
    "industries": [],
    "connectsTo": [],
    "requires": [],
    "deployment": "not_stated",
    "pricing": "not_stated",
    "hide": false,
    "hideReason": "",
    "noFit": ""
  },
  "curated": {
    "overrides": {},
    "locked": false,
    "note": ""
  }
}
