{
  "appId": "PUBID.linccommunicationsptyltd1612428365087|AID.linc_woocommerce_integration|PAPPID.3008aa72-e55e-42cf-b61e-270f4acd8f4a",
  "guid": "3008aa72-e55e-42cf-b61e-270f4acd8f4a",
  "publisherId": "linccommunicationsptyltd1612428365087",
  "offerId": "linc_woocommerce_integration",
  "source": {
    "name": "Linc WooCommerce Integration",
    "publisher": "Linc Communications (Pty) Ltd",
    "productType": "DynamicsBC",
    "url": "https://appsource.microsoft.com/en-us/product/dynamics-365-business-central/PUBID.linccommunicationsptyltd1612428365087%7CAID.linc_woocommerce_integration%7CPAPPID.3008aa72-e55e-42cf-b61e-270f4acd8f4a",
    "lastModified": "2026-10-15T09:24:50.2572073+00:00",
    "appVersion": "27.26.2479.524",
    "pricingTypes": [],
    "freeTrial": null,
    "helpLink": "https://lincza.github.io/Linc-WooCommerce-Integration",
    "sourceHash": "sha256:3a8b45222af7c2f1423890e607673334fbf709e66f766579308b30f7403e9d78",
    "mentionsBC": true,
    "allCountries": false
  },
  "mapping": {
    "sourceHash": "sha256:3a8b45222af7c2f1423890e607673334fbf709e66f766579308b30f7403e9d78",
    "mappedOn": null,
    "summary": "Imports WooCommerce transactions into BC",
    "shape": "connector",
    "primary": [
      {
        "need": "ng-conn-webshop",
        "confidence": "high"
      }
    ],
    "secondary": [],
    "claims": [
      "Imports WooCommerce transactions via web service/API",
      "Custom mappings for imported transactions",
      "Turns transactions into sales or purchase documents",
      "Automated via job queue entries"
    ],
    "countries": [],
    "languages": [],
    "industries": [],
    "connectsTo": [
      "WooCommerce"
    ],
    "requires": [],
    "deployment": "not_stated",
    "pricing": "not_stated",
    "hide": false,
    "hideReason": "",
    "noFit": ""
  },
  "curated": {
    "overrides": {},
    "locked": false,
    "note": ""
  }
}
