{
  "appId": "PUBID.youngpartners1588093205397|AID.navitrans_365_truck_appointment|PAPPID.651556c7-07c5-4bac-84fa-9a92986baf4d",
  "guid": "651556c7-07c5-4bac-84fa-9a92986baf4d",
  "publisherId": "youngpartners1588093205397",
  "offerId": "navitrans_365_truck_appointment",
  "source": {
    "name": "Navitrans 365 Truck Appointment",
    "publisher": "Navitrans",
    "productType": "DynamicsBC",
    "url": "https://appsource.microsoft.com/en-us/product/dynamics-365-business-central/PUBID.youngpartners1588093205397%7CAID.navitrans_365_truck_appointment%7CPAPPID.651556c7-07c5-4bac-84fa-9a92986baf4d",
    "lastModified": "2026-10-30T14:17:27.9238629+00:00",
    "appVersion": "29.0.0.80827",
    "pricingTypes": [
      "ExternalFreeTrial"
    ],
    "freeTrial": null,
    "helpLink": "https://www.navitrans.eu/our-services/tms/",
    "sourceHash": "sha256:c0f808aa30913685158c6814b66903f488c6bf190085e96151b8a4802921999d",
    "mentionsBC": true
  },
  "mapping": {
    "sourceHash": "sha256:c0f808aa30913685158c6814b66903f488c6bf190085e96151b8a4802921999d",
    "mappedOn": "2026-10-30",
    "summary": "Truck appointment module for Navitrans 365.",
    "shape": "addon",
    "primary": [
      {
        "need": "ng-transport-planning",
        "confidence": "low"
      },
      {
        "need": "ng-vert-transport-logistics",
        "confidence": "medium"
      }
    ],
    "secondary": [],
    "claims": [
      "Add-on module for Navitrans 365",
      "Part of the Navitrans 365 suite covering TMS, WMS and forwarding",
      "Supports Business Central Essentials and Premium"
    ],
    "countries": [
      "BE",
      "DE",
      "DK",
      "FR",
      "GB",
      "NL"
    ],
    "languages": [
      "da",
      "en",
      "fr",
      "nl"
    ],
    "industries": [],
    "connectsTo": [],
    "requires": [
      "Navitrans 365"
    ],
    "deployment": "not_stated",
    "pricing": "free_trial",
    "hide": false,
    "hideReason": "",
    "noFit": ""
  },
  "curated": {
    "overrides": {},
    "locked": false,
    "note": ""
  }
}
