{
  "appId": "PUBID.applibra|AID.al_foundation_app|PAPPID.276d231a-96fc-4cc8-a606-0e9f98a29234",
  "guid": "276d231a-96fc-4cc8-a606-0e9f98a29234",
  "publisherId": "applibra",
  "offerId": "al_foundation_app",
  "source": {
    "name": "AL Foundation App",
    "publisher": "Applibra",
    "productType": "DynamicsBC",
    "url": "https://appsource.microsoft.com/en-us/product/dynamics-365-business-central/PUBID.applibra%7CAID.al_foundation_app%7CPAPPID.276d231a-96fc-4cc8-a606-0e9f98a29234",
    "lastModified": "2026-10-22T08:07:10.7859589+00:00",
    "appVersion": "28.0.26.10220848",
    "pricingTypes": [
      "ExternalFreeTrial"
    ],
    "freeTrial": null,
    "helpLink": "https://applibra.com/apps/al-foundation-app/help",
    "sourceHash": "sha256:80c25d646c413088244b1f9626ace0fcb2252d0a6518281f46e908d9874f2b06",
    "mentionsBC": true
  },
  "mapping": {
    "sourceHash": "sha256:80c25d646c413088244b1f9626ace0fcb2252d0a6518281f46e908d9874f2b06",
    "mappedOn": "2026-10-30",
    "summary": "Free base component for AppLibra apps; also gives a flat posted sales/purchase line register.",
    "shape": "usability",
    "primary": [
      {
        "need": "ng-ux-excel-reporting",
        "confidence": "low"
      }
    ],
    "secondary": [
      "ng-bi-dashboards"
    ],
    "claims": [
      "Writes one flat entry per posted sales or purchase line with header fields alongside",
      "Four registers: sales, purchases, sales shipments, purchase receipts",
      "Registers are exposed as API queries for Power BI and other tools",
      "Entries for a period can be rebuilt from posted documents",
      "Classifies units of measure by type and priority",
      "Dated hierarchies of customers, vendors, items, salespeople and groups",
      "Free of charge",
      "Online only, BC 28.0 or later"
    ],
    "countries": [],
    "languages": [
      "en",
      "it"
    ],
    "industries": [],
    "connectsTo": [],
    "requires": [],
    "deployment": "online",
    "pricing": "free",
    "hide": true,
    "hideReason": "Dependency/base library installed with other AppLibra apps.",
    "noFit": ""
  },
  "curated": {
    "overrides": {},
    "locked": false,
    "note": ""
  }
}
