{
  "appId": "PUBID.markmannmllerdatensystemegmbh1610701000601|AID.mumdat_avail_lights_sales_purchase_overview|PAPPID.856d74a8-691e-4ae6-b9fe-f908aee860a9",
  "guid": "856d74a8-691e-4ae6-b9fe-f908aee860a9",
  "publisherId": "markmannmllerdatensystemegmbh1610701000601",
  "offerId": "mumdat_avail_lights_sales_purchase_overview",
  "source": {
    "name": "m+m Availability Signs with Sales Purchase Line Overview",
    "publisher": "Markmann + Müller Datensysteme GmbH",
    "productType": "DynamicsBC",
    "url": "https://appsource.microsoft.com/en-us/product/dynamics-365-business-central/PUBID.markmannmllerdatensystemegmbh1610701000601%7CAID.mumdat_avail_lights_sales_purchase_overview%7CPAPPID.856d74a8-691e-4ae6-b9fe-f908aee860a9",
    "lastModified": "2026-06-08T16:17:20.5194564+00:00",
    "appVersion": "28.0.370889.0",
    "pricingTypes": [],
    "freeTrial": null,
    "helpLink": "https://www.mumdat.de/appsource",
    "sourceHash": "sha256:b855dd3ba5a5beccb7fc7940004f524f279d4d91d14b1c47f20e41ae64b93adc",
    "mentionsBC": true,
    "allCountries": false
  },
  "mapping": {
    "sourceHash": "sha256:b855dd3ba5a5beccb7fc7940004f524f279d4d91d14b1c47f20e41ae64b93adc",
    "mappedOn": null,
    "summary": "Shows item availability lights on documents",
    "shape": "process",
    "primary": [
      {
        "need": "ng-sales-order-entry",
        "confidence": "medium"
      }
    ],
    "secondary": [
      "ng-inventory-analysis"
    ],
    "claims": [
      "Availability lights for items in sales and purchase documents",
      "Supported BC editions as stated"
    ],
    "countries": [
      "AT",
      "BE",
      "CH",
      "CZ",
      "DE",
      "DK",
      "FR",
      "GB",
      "IT",
      "LV",
      "NL",
      "PL",
      "US"
    ],
    "languages": [
      "de",
      "en"
    ],
    "industries": [],
    "connectsTo": [],
    "requires": [],
    "deployment": "not_stated",
    "pricing": "not_stated",
    "hide": false,
    "hideReason": "",
    "noFit": ""
  },
  "curated": {
    "overrides": {},
    "locked": false,
    "note": ""
  }
}
