{
  "appId": "PUBID.dynamics-eshop|AID.customerportal|PAPPID.649ff539-cdf4-46d5-9876-6a575bf24ace",
  "guid": "649ff539-cdf4-46d5-9876-6a575bf24ace",
  "publisherId": "dynamics-eshop",
  "offerId": "customerportal",
  "source": {
    "name": "Customer Portal for Dynamics 365 Business Central",
    "publisher": "Dynamics eShop Inc.",
    "productType": "DynamicsBC",
    "url": "https://appsource.microsoft.com/en-us/product/dynamics-365-business-central/PUBID.dynamics-eshop%7CAID.customerportal%7CPAPPID.649ff539-cdf4-46d5-9876-6a575bf24ace",
    "lastModified": "2026-08-05T04:37:58.0268066+00:00",
    "appVersion": "1.0.0.0",
    "pricingTypes": [],
    "freeTrial": null,
    "helpLink": "https://www.dynamicseshop.com/contact-us/",
    "sourceHash": "sha256:ac877bb4f203f836938dd7f34281b2d1a237c69edcd5ff0548885bb98d10931e",
    "mentionsBC": true,
    "allCountries": false
  },
  "mapping": {
    "sourceHash": "sha256:ac877bb4f203f836938dd7f34281b2d1a237c69edcd5ff0548885bb98d10931e",
    "mappedOn": null,
    "summary": "Self-service customer portal for account and transactions",
    "shape": "connector",
    "primary": [
      {
        "need": "ng-admin-portals",
        "confidence": "high"
      }
    ],
    "secondary": [
      "ng-customer-payments",
      "ng-crm-accounts"
    ],
    "claims": [
      "Self-service customer account management",
      "Online customer request and onboarding workflows",
      "Dashboards showing customer activity and use of the portal",
      "Pay open invoices with stored payment methods",
      "Lets customers print, save and view reports, invoices, orders and quotes",
      "Shipment tracking and order status",
      "Upload and download customer documents",
      "Alerts for customer activity",
      "Also for NAV and Finance and Operations"
    ],
    "countries": [],
    "languages": [
      "en"
    ],
    "industries": [],
    "connectsTo": [],
    "requires": [],
    "deployment": "not_stated",
    "pricing": "not_stated",
    "hide": false,
    "hideReason": "",
    "noFit": ""
  },
  "curated": {
    "overrides": {},
    "locked": false,
    "note": ""
  }
}
